{"id":"baseline","timestamp":"2026-04-08T12:58:23.395Z","hypothesis":"baseline","title":"Initial baseline","baselineMetric":0.995521,"resultMetric":0.995521,"delta":0,"status":"baseline","commitSha":"22a54cf","durationSeconds":371,"description":"Unmodified starting point"}
{"id":"cc39329b-57ad-4d07-a97f-889bbee5026d","timestamp":"2026-04-08T13:11:30.892Z","hypothesis":"reduce-batch-size","title":"Halve total batch size to 2^18","baselineMetric":0.995521,"resultMetric":0.987462,"delta":-0.008059000000000038,"status":"kept","commitSha":"0793f82","durationSeconds":392,"description":"Improved val_bpb: 0.995521 → 0.987462"}
{"id":"73513343-b003-4cc0-b36e-1d4fe4065257","timestamp":"2026-04-08T13:37:03.913Z","hypothesis":"increase-depth-to-10","title":"Increase DEPTH from 8 to 10","baselineMetric":0.995521,"resultMetric":0.986233,"delta":-0.009287999999999963,"status":"kept","commitSha":"47d8a15","durationSeconds":412,"description":"Improved val_bpb: 0.995521 → 0.986233"}
{"id":"5d58ccab-87b5-4176-8b81-532465a88688","timestamp":"2026-04-08T13:43:07.486Z","hypothesis":"add-warmup","title":"Add small LR warmup (2%)","baselineMetric":0.995521,"resultMetric":0.984317,"delta":-0.011203999999999992,"status":"kept","commitSha":"370996a","durationSeconds":364,"description":"Improved val_bpb: 0.995521 → 0.984317"}
{"id":"86b51f2e-f553-440c-9443-96515819be3b","timestamp":"2026-04-08T17:07:45.965Z","hypothesis":"swiglu-activation","title":"Replace ReLU-squared with SwiGLU in MLP","baselineMetric":0.995521,"resultMetric":null,"delta":null,"status":"crash","commitSha":null,"durationSeconds":51,"description":"Eval failed with exit code 127."}
{"id":"957f2552-3178-414f-bb26-ee27cdfb928b","timestamp":"2026-04-08T17:20:16.374Z","hypothesis":"reduce-warmdown-ratio","title":"Reduce warmdown ratio from 0.5 to 0.35","baselineMetric":0.995521,"resultMetric":null,"delta":null,"status":"crash","commitSha":null,"durationSeconds":51,"description":"Eval failed with exit code 1."}
{"id":"f9bca313-991a-43d5-9be9-0a0b22a6be0a","timestamp":"2026-04-08T20:09:09.681Z","hypothesis":"raise-matrix-lr","title":"Increase Muon matrix LR from 0.04 to 0.06","baselineMetric":0.995521,"resultMetric":0.986586,"delta":-0.008935000000000026,"status":"reverted","commitSha":null,"durationSeconds":441,"description":"No improvement: 0.995521 → 0.986586"}
{"id":"e90ece81-aaca-4a32-a3db-c420f6628af8","timestamp":"2026-04-09T05:18:42.951Z","hypothesis":"shorter-sliding-window","title":"Reduce short window from seq/2 to seq/4","baselineMetric":0.995521,"resultMetric":0.983302,"delta":-0.01221899999999998,"status":"kept","commitSha":"761f101","durationSeconds":493,"description":"Improved val_bpb: 0.995521 → 0.983302"}
